kafka,author,text
False_,Goethe,"wort erhalten, es seie"
False_,Goethe,"asten, Wachen, Einsamk"
False_,Goethe," für ratsam, sie aus d"
False_,Goethe,"tteilte, die, wie Sie "
False_,Goethe,"eilte, die, wie Sie wi"
False_,Goethe,"n wollen, ohne eine Da"
False_,Goethe,"elegenheit, seine Rach"
False_,Goethe,"bster O**, mit Herzklo"
False_,Goethe,"zum Hoftor, in der Abs"
False_,Goethe," Biondello, der es zu "
False_,Goethe,"inander, ihm Dienste a"
False_,Goethe,"er Soldat, dessen oben"
False_,Goethe,"nd vermied er, mehr au"
False_,Goethe,"der Anton Pin, der übl"
False_,Goethe,"ernen ließ, beide soll"
False_,Goethe,"ndlung also, die der M"
False_,Goethe,"er und eilte, aus dem "
False_,Goethe," flechtend, eine seine"
False_,Goethe," verurteilte, die das "
False_,Goethe,"en Damen, die, wie wir"
False_,Goethe,"iejenigen, in deren Hä"
False_,Goethe,"ermuteten, ihn bei der"
False_,Goethe,"ottern wollte, erstarb"
False_,Goethe,"sbegriffe, in denen er"
False_,Goethe,"mmenfuhr, als er ihm n"
False_,Goethe,"wort erhalten, es seie"
False_,Goethe,"r sie hielten, ist her"
False_,Goethe,"as waren die, in denen"
False_,Goethe,"er Tochter, einem Mädc"
False_,Goethe,"t davon, ihm einen ein"
False_,Goethe," Z***, der, wie Sie wi"
False_,Goethe,"he wert halte, einen k"
False_,Goethe,"es Tages, als eine zah"
False_,Goethe," Schritt, den er tat, "
False_,Goethe,"der Anton Pin, der übl"
False_,Goethe,"er und eilte, aus dem "
False_,Goethe,"r und eilte, aus dem G"
False_,Goethe,"mstände, die niemand a"
False_,Goethe,"rädikate, die eine Han"
False_,Goethe,"stand, der, weit entfe"
False_,Goethe,"mehrmals, seien ihm je"
False_,Goethe," prangte, die seiner w"
False_,Goethe,"wie die Ihrige, auf, m"
False_,Goethe,"sche Offizier, den ich"
False_,Goethe,"ermuteten, ihn bei der"
False_,Goethe,"sbegriffe, in denen er"
False_,Goethe,"hr Bruder, ist auf ewi"
False_,Goethe,"n wollen, ohne eine Da"
False_,Goethe,"indernis, vereinigt mi"
False_,Goethe,"aus dem Saal, der Virt"
False_,Goethe,"emeldet, die seine rei"
False_,Goethe," Z***, der, wie Sie wi"
False_,Goethe," Biondello, den er her"
False_,Goethe,"he wert halte, einen k"
False_,Goethe,"esen hat, die Erben hi"
False_,Goethe," Schritt, den er tat, "
False_,Goethe,"hre Mutter, eine Frau "
False_,Goethe," das andre, eine Glück"
False_,Goethe,"e Biondello, so gut er"
False_,Goethe," er konnte, in der Eil"
False_,Goethe,"en Damen, die, wie wir"
False_,Goethe,"mehrmals, seien ihm je"
False_,Goethe,"n stürze, Visionärs un"
False_,Goethe,"lt hatte, denn sie ver"
False_,Goethe,"ermuteten, ihn bei der"
False_,Goethe,"lso vor, sie an den Me"
False_,Goethe,"te blasend, seine Kame"
False_,Goethe,"Prokurator, sein vorig"
False_,Goethe,"bryonen, die sie mit s"
False_,Goethe," Biondello, den er her"
False_,Goethe,"nt hatte, die Geschich"
False_,Goethe,"em Gondolier, der sich"
False_,Goethe," die andre, ein Fest d"
False_,Goethe,"t wert war, einem solc"
False_,Goethe,"lebhafter, ihre Stimme"
False_,Goethe,"ellenza, die, wie die "
False_,Goethe,"ernen ließ, beide soll"
False_,Goethe,"r und eilte, aus dem G"
False_,Goethe,"and darin, beiden Andä"
False_,Goethe," er konnte, in der Eil"
False_,Goethe,"mehrmals, seien ihm je"
False_,Goethe," prangte, die seiner w"
False_,Goethe,"lt hatte, denn sie ver"
False_,Goethe,"ermuteten, ihn bei der"
False_,Goethe,"sregeln vor, die sie k"
False_,Goethe,"n sollte, keine besser"
False_,Goethe,"ar. Die Ruhe, die Vern"
False_,Goethe,". Biondello, der indes"
False_,Goethe,"t davon, ihm einen ein"
False_,Goethe," angefüllt, die, wie e"
False_,Goethe,"Sie nun, diese Meinung"
False_,Goethe,"n Biondello, den er he"
False_,Goethe,"e wert halte, einen kü"
False_,Goethe,"ürmten in ihn, seine K"
False_,Goethe,"es Tages, als eine zah"
False_,Goethe,"anderen, die sie vorüb"
False_,Goethe,"r und eilte, aus dem G"
False_,Goethe,"r Biondello, der am Ei"
False_,Goethe,"öpfen wollten, die sic"
False_,Goethe,"and darin, beiden Andä"
False_,Goethe," zu wagen, die, wenn s"
False_,Goethe,"den Damen, die, wie wi"
False_,Goethe,"et hatte, die aber sch"
False_,Goethe,"rn Grade, dies Letzter"
False_,Goethe,"n konnte, mit einer Tü"
False_,Goethe,"n Sie wohl, liebster F"
False_,Goethe,"inte-Croix«, sagte ein"
False_,Goethe,"te blasend, seine Kame"
False_,Goethe,". Biondello, der indes"
False_,Goethe,"iondello, der indes mi"
False_,Goethe,"emeldet, die seine rei"
False_,Goethe,"ine Mühe, keine Kosten"
False_,Goethe,"bryonen, die sie mit s"
False_,Goethe,"n Biondello, den er he"
False_,Goethe,"sung hatte, eine reich"
False_,Goethe,"inander, ihm Dienste a"
False_,Goethe," die andre, ein Fest d"
False_,Goethe,"r Biondello, der am Ei"
False_,Goethe," sich vor, ihre Standh"
False_,Goethe," zu wagen, die, wenn s"
False_,Goethe,"den Damen, die, wie wi"
False_,Goethe,"en Damen, die, wie wir"
False_,Goethe,"iejenigen, in deren Hä"
False_,Goethe,"ürzen ließ, ohne jedoc"
False_,Goethe,"rn Grade, dies Letzter"
False_,Goethe,"ottern wollte, erstarb"
False_,Goethe,"uquenoi, die Angelegen"
False_,Goethe,"n konnte, mit einer Tü"
False_,Goethe,"inte-Croix«, sagte ein"
False_,Goethe,"te blasend, seine Kame"
False_,Goethe," Biondello, bei dem er"
False_,Goethe,"t davon, ihm einen ein"
False_,Goethe,"Prokurator, sein vorig"
False_,Goethe,"ine Mühe, keine Kosten"
False_,Goethe,"n Biondello, den er he"
False_,Goethe,"zum Hoftor, in der Abs"
False_,Goethe,"inander, ihm Dienste a"
False_,Goethe," die andre, ein Fest d"
False_,Goethe,"ngen hatte, eine achtz"
False_,Goethe,"nd vermied er, mehr au"
False_,Goethe,"zellenza, die, wie die"
False_,Goethe,"ellenza, die, wie die "
False_,Goethe,"r und eilte, aus dem G"
False_,Goethe,"en wird, diesen außero"
False_,Goethe," zu wagen, die, wenn s"
False_,Goethe,"den Damen, die, wie wi"
False_,Goethe,"n Damen, die, wie wir "
False_,Goethe,"iejenigen, in deren Hä"
False_,Goethe,"rn Grade, dies Letzter"
False_,Goethe,"ottern wollte, erstarb"
False_,Goethe,"uquenoi, die Angelegen"
False_,Goethe,"sbegriffe, in denen er"
False_,Goethe,"n konnte, mit einer Tü"
False_,Goethe,"n Sie wohl, liebster F"
False_,Goethe,"inte-Croix«, sagte ein"
False_,Goethe," Biondello, bei dem er"
False_,Goethe,"emeldet, die seine rei"
False_,Goethe,"raten sollte, und 3. a"
False_,Goethe," Z***, der, wie Sie wi"
False_,Goethe,"n Biondello, den er he"
False_,Goethe,"ürmten in ihn, seine K"
False_,Goethe,"e Glück, dieses allgem"
False_,Goethe,"nd vermied er, mehr au"
False_,Goethe,"zellenza, die, wie die"
False_,Goethe," das andre, eine Glück"
False_,Goethe,"er und eilte, aus dem "
False_,Goethe,"en wird, diesen außero"
False_,Goethe," zu wagen, die, wenn s"
False_,Goethe,"n stürze, Visionärs un"
False_,Goethe,"sche Offizier, den ich"
False_,Goethe,"rn Grade, dies Letzter"
False_,Goethe,"assen wollte, auf Antw"
False_,Goethe,"terben sollte, ehe ich"
False_,Goethe,"regeln vor, die sie kü"
False_,Goethe,"mitteilte, die, wie Si"
False_,Goethe,"teilte, die, wie Sie w"
False_,Goethe,"iondello, der indes mi"
False_,Goethe,"« Biondello, der diese"
False_,Goethe,"en wird, diesen außero"
False_,Goethe," Umstand, der, weit en"
False_,Goethe,"stand, der, weit entfe"
False_,Goethe,"lechtend, eine seiner "
False_,Goethe,"n Damen, die, wie wir "
False_,Goethe,"r abends, als sie den "
False_,Goethe,"ürzen ließ, ohne jedoc"
False_,Goethe,"n sollte, »es ist unnö"
False_,Goethe,"iehen wollte, wenn sie"
False_,Goethe,"für ratsam, sie aus di"
False_,Goethe,"indernis, vereinigt mi"
False_,Goethe,"Prokurator, sein vorig"
False_,Goethe,"e wert halte, einen kü"
False_,Goethe,"ürmten in ihn, seine K"
False_,Goethe,"anderen, die sie vorüb"
False_,Goethe,"en wird, diesen außero"
False_,Goethe," Umstand, der, weit en"
False_,Goethe,"n Damen, die, wie wir "
False_,Goethe,"rhindert, Ihre Blicke "
False_,Goethe,"mmenfuhr, als er ihm n"
False_,Goethe,"ürmten in ihn, seine K"
False_,Goethe,"dem Gondolier, der sic"
False_,Goethe," vernommen, heißt es u"
False_,Goethe,"anderen, die sie vorüb"
False_,Goethe,"er und eilte, aus dem "
False_,Goethe,"r Biondello, der am Ei"
False_,Goethe,"dung stand, eine Kabal"
False_,Goethe,"ntersagte, in den Ange"
False_,Goethe,"mmenfuhr, als er ihm n"
False_,Goethe,"sregeln vor, die sie k"
False_,Goethe,"regeln vor, die sie kü"
False_,Goethe,"Sie nun, diese Meinung"
False_,Goethe,"Prokurator, dessen Vat"
False_,Goethe,"inander, ihm Dienste a"
False_,Goethe,"ngen hatte, eine achtz"
False_,Goethe," Neigung, die, bloß du"
False_,Goethe," sich vor, ihre Standh"
False_,Goethe,"en Damen, die, wie wir"
False_,Goethe,"n Damen, die, wie wir "
False_,Goethe,"ürzen ließ, ohne jedoc"
False_,Goethe,"erben sollte, ehe ich "
False_,Goethe,"werden sollte, keine b"
False_,Goethe,"für ratsam, sie aus di"
False_,Goethe,"r sie hielten, ist her"
False_,Goethe," Biondello, bei dem er"
False_,Goethe,"ist davon, ihm einen e"
False_,Goethe,"ück Geld, Sie dem ande"
False_,Goethe,"l Biondello, der es zu"
False_,Goethe,"s Livorno, ein deutsch"
False_,Goethe," Livorno, ein deutsche"
False_,Goethe,"der Soldat, dessen obe"
False_,Goethe,"en Vorteil, den die Fr"
False_,Goethe,"ne Madonna, eine Heloi"
False_,Goethe,"m er stand, seine Fluc"
False_,Goethe," Dinge, die, einzeln g"
False_,Goethe,"Dinge, die, einzeln ge"
False_,Goethe,"und Anton Pin, den gan"
False_,Goethe,"holen sollte, »es ist "
False_,Goethe,"bringen, oder, was ebe"
False_,Goethe,"gen, oder, was ebensov"
False_,Goethe,"e Ihrige, auf, meine W"
False_,Goethe,"ttern wollte, erstarb "
False_,Goethe," es denen, in deren Hä"
False_,Goethe,"e Genuß, dieses Mahl v"
False_,Goethe," er wieder, in einen M"
False_,Goethe," waren die, in denen S"
False_,Goethe,"ar. Die Ruhe, die Vern"
False_,Goethe,"ist davon, ihm einen e"
False_,Goethe,"st davon, ihm einen ei"
False_,Goethe,"l Biondello, der es zu"
False_,Goethe,"s Livorno, ein deutsch"
False_,Goethe," Livorno, ein deutsche"
False_,Goethe,"ne Madonna, eine Heloi"
False_,Goethe,"m er stand, seine Fluc"
False_,Goethe,"bringen, oder, was ebe"
False_,Goethe,"gen, oder, was ebensov"
False_,Goethe," Vorwürfe, ihren Strei"
False_,Goethe,"e Ihrige, auf, meine W"
False_,Goethe,"ttern wollte, erstarb "
False_,Goethe," er wieder, in einen M"
False_,Goethe,"er wieder, in einen Ma"
False_,Goethe,"lt hatte, als er sich "
False_,Goethe,"ar. Die Ruhe, die Vern"
False_,Goethe,"ist davon, ihm einen e"
False_,Goethe,"ich enthalte, insofern"
False_,Goethe,"e wert halte, einen kü"
False_,Goethe,"en hatte, die ihn in d"
False_,Goethe,"s Livorno, ein deutsch"
False_,Goethe,"er konnte, in der Eile"
False_,Goethe,"r abends, als sie den "
False_,Goethe,"bringen, oder, was ebe"
False_,Goethe,"anden sie, in einer ge"
False_,Goethe,"h also vor, sie an den"
False_,Goethe,"ttern wollte, erstarb "
False_,Goethe," es denen, in deren Hä"
False_,Goethe,"wegen konnte, es zu ve"
False_,Goethe,"assen wollte, auf Antw"
False_,Goethe," er wieder, in einen M"
False_,Goethe,"geben wollte, daß ihre"
False_,Goethe,"ist davon, ihm einen e"
False_,Goethe,"« Biondello, der diese"
False_,Goethe,"eiligen, diese Altäre,"
False_,Goethe,"dem Gondolier, der sic"
False_,Goethe," vernommen, heißt es u"
False_,Goethe,"s Livorno, ein deutsch"
False_,Goethe," Livorno, ein deutsche"
False_,Goethe,"en worden, ist eine Tu"
False_,Goethe,"er konnte, in der Eile"
False_,Goethe,"dung stand, eine Kabal"
False_,Goethe,"r abends, als sie den "
False_,Goethe," standen sie, in einer"
False_,Goethe,"anden sie, in einer ge"
False_,Goethe,"enthalts, der, wie ich"
False_,Goethe,"eln vor, die sie künft"
False_,Goethe,"erden sollte, keine be"
False_,Goethe,"t für ratsam, sie aus "
False_,Goethe,"itteilte, die, wie Sie"
False_,Goethe,"e Biondello, bei dem e"
False_,Goethe,"Biondello, bei dem er "
False_,Goethe,"st davon, ihm einen ei"
False_,Goethe,"emälden, die sie merkw"
False_,Goethe,"en hatte, die ihn in d"
False_,Goethe,"um Hoftor, in der Absi"
False_,Goethe,"ernen wollte, den Sain"
False_,Goethe,"ier Dinge, die, einzel"
False_,Goethe,"er Dinge, die, einzeln"
False_,Goethe,"r Dinge, die, einzeln "
False_,Goethe,"bholen sollte, »es ist"
False_,Goethe,"enthalts, der, wie ich"
False_,Goethe,"t für ratsam, sie aus "
False_,Goethe,"er wieder, in einen Ma"
False_,Goethe,"lt hatte, als er sich "
False_,Goethe,"waren die, in denen Si"
False_,Goethe,"emälden, die sie merkw"
False_,Goethe,"en hatte, die ihn in d"
False_,Goethe,"lechtend, eine seiner "
False_,Goethe," es denen, in deren Hä"
False_,Goethe,"enthalts, der, wie ich"
False_,Goethe,"e Biondello, bei dem e"
False_,Goethe,"Biondello, bei dem er "
False_,Goethe,"st davon, ihm einen ei"
False_,Goethe,"eiligen, diese Altäre,"
False_,Goethe,"en hatte, keine andre "
False_,Goethe,"emälden, die sie merkw"
False_,Goethe,"um Hoftor, in der Absi"
False_,Goethe," Livorno, ein deutsche"
False_,Goethe,"gen, oder, was ebensov"
False_,Goethe," standen sie, in einer"
False_,Goethe,"enthalts, der, wie ich"
False_,Goethe,"eln vor, die sie künft"
False_,Goethe,"er wieder, in einen Ma"
False_,Goethe,"e Biondello, bei dem e"
False_,Goethe,"Biondello, bei dem er "
False_,Goethe,"st davon, ihm einen ei"
False_,Goethe,"emälden, die sie merkw"
False_,Goethe,"ten lang, ohne ein Wor"
False_,Goethe," Vorwürfe, ihren Strei"
True_,Kafka,"a sowohl, als seine Fr"
True_,Kafka,"plündernd, ein silbern"
True_,Kafka,"bedurfte, als Einsicht"
True_,Kafka,"machen sollte, ein Zei"
True_,Kafka,"rafen wollte, gibt ihr"
True_,Kafka,"Wunde, die er, zu Anfa"
True_,Kafka,"leidern, die sie schne"
True_,Kafka,"nd hilflos, in der Mit"
True_,Kafka,"setzen wolle, ihn aus "
True_,Kafka,"rte, daß sie, in diese"
True_,Kafka,"ute vor, daß sie in ih"
True_,Kafka,"ürt hatte, mit einem H"
True_,Kafka,"ffend, etwas, das ihm "
True_,Kafka,"ist; geh, Herse, geh z"
True_,Kafka,"m hatte Elvire, in ein"
True_,Kafka,", wenn er, in der heut"
True_,Kafka," Himmel, diese deine E"
True_,Kafka," mit Rosalien, ihrer K"
True_,Kafka,"en revidierte, den Wun"
True_,Kafka,"nn würde, bis in sein "
True_,Kafka,"zu helfen, in Ermangel"
True_,Kafka,"e, daß er, in einem El"
True_,Kafka,"den hatte, rief, indem"
True_,Kafka,"eiten Piachis, über di"
True_,Kafka,"e hingen ihm, in schli"
True_,Kafka,"üte Gott, rief der Kne"
True_,Kafka,"n Junker, an dessen Da"
True_,Kafka,"uldig hielten, oder da"
True_,Kafka,"nvermutet, in eben die"
True_,Kafka,"n Meierei, die, in Geb"
True_,Kafka,"schafft, diese Stadt z"
True_,Kafka,", erzog er, in der Fur"
True_,Kafka,"nzeige, die sie, durch"
True_,Kafka,"f der Prior, indem er "
True_,Kafka,"gt worden, in einem Wi"
True_,Kafka,"ne fremde, in das Land"
True_,Kafka,"erungen, die sie sich "
True_,Kafka,"Stellung, die er in de"
True_,Kafka,"lt hatte, als den Vate"
True_,Kafka,"Tochter, die sie von d"
True_,Kafka," Pferde, die er bei si"
True_,Kafka,"ist noch, mit einer ni"
True_,Kafka,"ine Tür, die, an der h"
True_,Kafka,"Offizier, der, nach de"
True_,Kafka,", vorstellte, nötigte "
True_,Kafka,"ern würde, verstehen s"
True_,Kafka,"eisen, der ihr, bei ih"
True_,Kafka,"u dem Kinde, das sie g"
True_,Kafka,", als Toni, die Latern"
True_,Kafka," gehen sollte, fing se"
True_,Kafka," Pferde, mit einer sch"
True_,Kafka," die Pferde, als sie z"
True_,Kafka," Alten, Toni anbetreff"
True_,Kafka,"r Stadt, um sie vor ei"
True_,Kafka,"inen Apfel, den sie in"
True_,Kafka,"eute so, die sie, in b"
True_,Kafka,"sem Vorfall, sie begnü"
True_,Kafka,"en verfiel, den Kohlha"
True_,Kafka,"gefunden, als die sech"
True_,Kafka,"und da sie ihm, mit sc"
True_,Kafka,"acheilte, rief, daß ma"
True_,Kafka,"schwerten, mit in dem "
True_,Kafka,"erlorenen, in seinem Z"
True_,Kafka,"erhalten, als er, so b"
True_,Kafka," Fremde aß, in sein An"
True_,Kafka,"re Arbeit, mit einer W"
True_,Kafka,"zuklagen, er, heiteren"
True_,Kafka,"ben wußte, in der Küch"
True_,Kafka," in die Haare, da er u"
True_,Kafka,"« Die Frau, indem sie "
True_,Kafka,"agte Toni, indem sie v"
True_,Kafka,"en würden, in Besitz z"
True_,Kafka," von Tronka, verwandt "
True_,Kafka," und zog, als sämtlich"
True_,Kafka,", fand, daß, obschon d"
True_,Kafka,"prach er ihr, sobald e"
True_,Kafka," die Tat, die er began"
True_,Kafka,"sinuation, bei dem Dre"
True_,Kafka," wiederholte, und, auf"
True_,Kafka,"n Oheim, mit seiner Ge"
True_,Kafka,"rr Strömli, dessen Wun"
True_,Kafka,"ichen Sohn, in einem G"
True_,Kafka,"er Kaiser, in einer du"
True_,Kafka,"end Ritter, denen alle"
True_,Kafka,"her sowohl, als auch d"
True_,Kafka,"seine Frau, in Schutz "
True_,Kafka," Tor jagte, rief, um d"
True_,Kafka,"er Kosten, in den Stäl"
True_,Kafka,"einbilde, er, der Kanz"
True_,Kafka,"Er setzte, mit einem e"
True_,Kafka,"r setzte, mit einem et"
True_,Kafka,"er ja tot sei, versich"
True_,Kafka,"als daß er, in einer S"
True_,Kafka," geben wollte, zog sic"
True_,Kafka,"geben wollte, zog sich"
True_,Kafka,"en? Ja, wo ist, so lan"
True_,Kafka,"ge erlöst, in seine Ar"
True_,Kafka,"igeunerin, die, auf ei"
True_,Kafka,"eröffnete, mit einem u"
True_,Kafka,"er Tod malte, bei den "
True_,Kafka,"eckung, er, sein Sohn "
True_,Kafka,"nternommen, seine Inst"
True_,Kafka,"n: so trat er, indem e"
True_,Kafka,"o trat er, indem er si"
True_,Kafka,"nzuflößen, teils um da"
True_,Kafka,"nd fragte, was sie in "
True_,Kafka,"auben wolle, auf einen"
True_,Kafka,"haltend, alles, was vo"
True_,Kafka,"allen sollte, dies all"
True_,Kafka," forderte, mit rasende"
True_,Kafka,"reten, daß er, soviel "
True_,Kafka,"chützen, der, bei ihre"
True_,Kafka,"rer Jugend, seine erst"
True_,Kafka,"ufloderte, einer der e"
True_,Kafka,"ßer etwa, daß er, auf "
True_,Kafka,"llschaft, die er nicht"
True_,Kafka,"ohlhaas, der, in eben "
True_,Kafka,"ß wären, ihn, um seine"
True_,Kafka,"bt hatte, niederzuknie"
True_,Kafka,"gos sowohl, als ihrer "
True_,Kafka,"indem sie, mit einem A"
True_,Kafka," allem Volk, am Kirche"
True_,Kafka,"Tage darauf, diesen Vo"
True_,Kafka,"dem Maße, als er weite"
True_,Kafka,"etzte sie, indem sie s"
True_,Kafka," melden, daß er, Kohlh"
True_,Kafka,"sagen wollte, und sagt"
True_,Kafka,"und Leopold, seine bei"
True_,Kafka,"nd zu Toni, indem er i"
True_,Kafka,"nd trug sie, indem er "
True_,Kafka,"en werde, hingehalten "
True_,Kafka,"hatte, und er, die Bru"
True_,Kafka,"nzenden, die Erde mit "
True_,Kafka,"au sagte, daß sie ein "
True_,Kafka,"ihr Vater, ein bemitte"
True_,Kafka,"genheit, diesen Vorsat"
True_,Kafka,"swindend, rief er den "
True_,Kafka,"en, als Toni, zitternd"
True_,Kafka,"beteuerte, indem sie s"
True_,Kafka,"m glatten, ihm entschl"
True_,Kafka,"ührte, und er, indem e"
True_,Kafka,"twortete, und, ihr Hau"
True_,Kafka,"angen ist, in sein Gef"
True_,Kafka,"nkauf der, ihre Grenze"
True_,Kafka,"racht ward, rief, da s"
True_,Kafka,"ammerzofe, die einzige"
True_,Kafka,"in Bett, wo sie, unter"
True_,Kafka,"Schwert, wisse, das du"
True_,Kafka,"ofpforte, den er in de"
True_,Kafka,"leidern, die sie schne"
True_,Kafka,"dem Frevel, dessen er "
True_,Kafka,"r Wagen, der, beim Anb"
True_,Kafka,"Wagen, der, beim Anbru"
True_,Kafka,"derte, daß sie, in die"
True_,Kafka,"jammernd, ohne sich zu"
True_,Kafka,"rte, daß sie, in diese"
True_,Kafka,"m wandte, und, indem e"
True_,Kafka,"Besseren, eine, dem Au"
True_,Kafka,"esseren, eine, dem Aus"
True_,Kafka,"ten Ritter, ihren Arm,"
True_,Kafka,"ach, der, seit seiner "
True_,Kafka," war ihr, als sie nied"
True_,Kafka,"enommen hatte, sehr er"
True_,Kafka,"mmen hatte, sehr erfre"
True_,Kafka,"och da Elvire, starr v"
True_,Kafka,"er Sache, an, was dies"
True_,Kafka,", sei sie, in diesem Z"
True_,Kafka,"en revidierte, den Wun"
True_,Kafka,"e, daß er, in einem El"
True_,Kafka," er sagte, indem er di"
True_,Kafka,"den hatte, rief, indem"
True_,Kafka,"eiten Piachis, über di"
True_,Kafka,"e hingen ihm, in schli"
True_,Kafka,"der Ritter, die ihm fo"
True_,Kafka,"drückte, daß, sobald d"
True_,Kafka,"genommen, als sie ihn "
True_,Kafka,"menraffte, in die Kamm"
True_,Kafka,"uldig hielten, oder da"
True_,Kafka," Gebärden, mit sich fo"
True_,Kafka,"schafft, diese Stadt z"
True_,Kafka,", erzog er, in der Fur"
True_,Kafka,"Betrübnis, in einiger "
True_,Kafka,"werden, teils, um das "
True_,Kafka,"sagte die Alte, mit ei"
True_,Kafka,"wagt hätte, sie anzuha"
True_,Kafka,"prechen, an, stieg, al"
True_,Kafka,"Stellung, die er in de"
True_,Kafka," Tochter, die sie von "
True_,Kafka,"Tochter, die sie von d"
True_,Kafka," Pferde, die er bei si"
True_,Kafka,"Kohlhaas, mit einem sp"
True_,Kafka,"h eine Tür, die, an de"
True_,Kafka,"ist noch, mit einer ni"
True_,Kafka,"ine Tür, die, an der h"
True_,Kafka,"; und da sie, mit eine"
True_,Kafka,"m Ritter, mit einem fu"
True_,Kafka,"nn fragte, indem er ih"
True_,Kafka,"isen, der ihr, bei ihr"
True_,Kafka,", als Toni, die Latern"
True_,Kafka,"erhielt, dieselbe zur "
True_,Kafka," Alten, Toni anbetreff"
True_,Kafka," sehen, wo er, wie man"
True_,Kafka,"Sie gelobte, diesem, w"
True_,Kafka,"h länger, als eben nöt"
True_,Kafka," wären alle, das könnt"
True_,Kafka,"eute so, die sie, in b"
True_,Kafka,"sem Vorfall, sie begnü"
True_,Kafka,"en verfiel, den Kohlha"
True_,Kafka,"gefunden, als die sech"
True_,Kafka,"chied ihn, in einigen "
True_,Kafka,"acheilte, rief, daß ma"
True_,Kafka,"ein, erfüllte, aus dem"
True_,Kafka,"enblick, da sie, zu se"
True_,Kafka,"itter, der sie, in ihr"
True_,Kafka," Fremde aß, in sein An"
True_,Kafka,"uns das Tier, diesem s"
True_,Kafka,"remde aß, in sein Antl"
True_,Kafka,"re Arbeit, mit einer W"
True_,Kafka,"zuklagen, er, heiteren"
True_,Kafka,"ben wußte, in der Küch"
True_,Kafka,"lagen, er, heiteren An"
True_,Kafka,"« Die Frau, indem sie "
True_,Kafka,"agte Toni, indem sie v"
True_,Kafka,"en würden, in Besitz z"
True_,Kafka," Arm, so, daß es ihn b"
True_,Kafka,": als Toni, den Knaben"
True_,Kafka,"rachte, als, auf jämme"
True_,Kafka,"ttend, das, ernst und "
True_,Kafka," dem Fort, in einem Ge"
True_,Kafka," die Tat, die er began"
True_,Kafka,"ewarfen, Herse, über d"
True_,Kafka,"den er ihm, in Bezug a"
True_,Kafka,"rr Strömli, dessen Wun"
True_,Kafka,"ichen Sohn, in einem G"
True_,Kafka,"ierung erließ, auf Ver"
True_,Kafka,"end Ritter, denen alle"
True_,Kafka,", daß sie ihn, in dies"
True_,Kafka,"ld legte, hinausreiche"
True_,Kafka,"weise: Rosalie, ihre K"
True_,Kafka,"r jagte, rief, um der "
True_,Kafka,"hen, und ihm, so gut e"
True_,Kafka,"einbilde, er, der Kanz"
True_,Kafka,"essen solle, sie liebe"
True_,Kafka,"hm leer blieb, sein Sc"
True_,Kafka,"e Kinder, diese ihre l"
True_,Kafka,"r setzte, mit einem et"
True_,Kafka,"er ja tot sei, versich"
True_,Kafka,"ßhändler ihm, ohne ihm"
True_,Kafka,"hn sogar, einige Jahre"
True_,Kafka,"ngt, und, ohne Verschu"
True_,Kafka,"eg, die alte, von der "
True_,Kafka,"esden, wo er, in einer"
True_,Kafka,"igeunerin, die, auf ei"
True_,Kafka,"eröffnete, mit einem u"
True_,Kafka,"eckung, er, sein Sohn "
True_,Kafka,"ebärdete, ihre Standha"
True_,Kafka,"n: so trat er, indem e"
True_,Kafka,"n Bitte, sie, die im v"
True_,Kafka,"te die Alte, indem sie"
True_,Kafka,"en, fand, als er mit e"
True_,Kafka,"er bat er, in einer ku"
True_,Kafka,"haltend, alles, was vo"
True_,Kafka," auf. Toni, sobald der"
True_,Kafka,"allen sollte, dies all"
True_,Kafka," forderte, mit rasende"
True_,Kafka,"em Handel, in dem er v"
True_,Kafka,"reten, daß er, soviel "
True_,Kafka,"gte die Alte, welche d"
True_,Kafka,"chützen, der, bei ihre"
True_,Kafka,"noch obwalte, heben wü"
True_,Kafka,"röffnete ihm, die Brie"
True_,Kafka,"zen, der, bei ihrem An"
True_,Kafka," rief sie, indem sie s"
True_,Kafka,"et von Xavieren, worin"
True_,Kafka,"h hörbar ward, das ein"
True_,Kafka,"issend, wohin sie sich"
True_,Kafka,"llschaft, die er nicht"
True_,Kafka,"ohlhaas, der, in eben "
True_,Kafka,"ß wären, ihn, um seine"
True_,Kafka,"gos sowohl, als ihrer "
True_,Kafka,"indem sie, mit einem A"
True_,Kafka,"Knaben vorbei, der mit"
True_,Kafka,"dem Maße, als er weite"
True_,Kafka," melden, daß er, Kohlh"
True_,Kafka,"sagen wollte, und sagt"
True_,Kafka,"d Leopold, seine beide"
True_,Kafka," Leopold, seine beiden"
True_,Kafka,"Freude, sagte, daß er "
True_,Kafka,"fig sind, bestimmten i"
True_,Kafka,"ihr Vater, ein bemitte"
True_,Kafka," fragte Toni, indem si"
True_,Kafka,"agte Toni, indem sie m"
True_,Kafka,"en, als Toni, zitternd"
True_,Kafka,", als Toni, zitternd u"
True_,Kafka,"m glatten, ihm entschl"
True_,Kafka,"ührte, und er, indem e"
True_,Kafka,"inden sollte, geschrie"
True_,Kafka,"nkauf der, ihre Grenze"
True_,Kafka,"ahm er Toni, die, von "
True_,Kafka," ersparen, ihn an sein"
True_,Kafka,"traße zog, mit ziemlic"
True_,Kafka,"ammerzofe, die einzige"
True_,Kafka,"ward, rief, da seine W"
True_,Kafka,"alt zwar, daß, wenn de"
True_,Kafka,"e traten, mit ihren Bl"
True_,Kafka,"ses stand, in seiner g"
True_,Kafka,"ofpforte, den er in de"
True_,Kafka,"sche Offizier, sehr er"
True_,Kafka,"leidern, die sie schne"
True_,Kafka,"en. Nicolo, der in dem"
True_,Kafka,"dem Frevel, dessen er "
True_,Kafka,"r Wagen, der, beim Anb"
True_,Kafka,"erwiderte, indem er, m"
True_,Kafka,"Wagen, der, beim Anbru"
True_,Kafka,"derte, daß sie, in die"
True_,Kafka,"f immerdar, die Verabs"
True_,Kafka,"m wandte, und, indem e"
True_,Kafka,"mmerdar, die Verabschi"
True_,Kafka,"ldsam, als er, über je"
True_,Kafka,"ten Ritter, ihren Arm,"
True_,Kafka,"ffend, etwas, das ihm "
True_,Kafka,"tsherr, der, vor Kohlh"
True_,Kafka,"mmen hatte, sehr erfre"
True_,Kafka,"be. Die alte, von der "
True_,Kafka,"ch wie vor, zu seinem "
True_,Kafka," Sobald Toni, die dies"
True_,Kafka,"Domingo, lebte, zu Anf"
True_,Kafka,"hatte, vorlas, hatte n"
True_,Kafka,"e Ritter, als sie bere"
True_,Kafka,"eiten Piachis, über di"
True_,Kafka,"ütpferde, die in seine"
True_,Kafka,"nd küßten ihn, und for"
True_,Kafka,"eß. Nicolo, der alle d"
True_,Kafka,"rn duftend, hereingeho"
True_,Kafka," zum Trotz, seinen Pla"
True_,Kafka,", erzog er, in der Fur"
True_,Kafka,"werden, teils, um das "
True_,Kafka,"ochen war, in seinem M"
True_,Kafka,"verloren, die er, in G"
True_,Kafka," Doch Toni, deren Brus"
True_,Kafka," Tochter, die sie von "
True_,Kafka,"r Pferde, daß es einem"
True_,Kafka,"Kohlhaas, mit einem sp"
True_,Kafka,"h eine Tür, die, an de"
