kafka,author,text
True_,Kafka,"et hatte, hervor, über"
True_,Kafka,"Schwert, wisse, das du"
True_,Kafka,"ses stand, in seiner g"
True_,Kafka,"ofpforte, den er in de"
True_,Kafka,"und da sie, einen groß"
True_,Kafka,"lispel, das, wie es ih"
True_,Kafka,"ter Wagen, der, beim A"
True_,Kafka,", fragte sie, indem er"
True_,Kafka,"gen würde, indem er li"
True_,Kafka,"auphin, wo, wie Ihr wi"
True_,Kafka,"Roßhändler, dessen Per"
True_,Kafka,"rte, daß sie, in diese"
True_,Kafka,"n Handel, der ihn ins "
True_,Kafka," herbeieilten, deine B"
True_,Kafka," Abend, sei sie, in di"
True_,Kafka,"ser Zeit, Herse, dem d"
True_,Kafka," Töchter, die Erlaubni"
True_,Kafka,", sei sie, in diesem Z"
True_,Kafka,", und wie ihr, bei dem"
True_,Kafka," war Nicolo, mit jener"
True_,Kafka,"zu helfen, in Ermangel"
True_,Kafka,"er tretend, ein Mädche"
True_,Kafka,"rtete sie, indem sie i"
True_,Kafka,"nden hatte, rief, inde"
True_,Kafka,"eiten Piachis, über di"
True_,Kafka,"inquartierte, die Rapp"
True_,Kafka,"drückte, daß, sobald d"
True_,Kafka,"genommen, als sie ihn "
True_,Kafka,"ückte, daß, sobald der"
True_,Kafka,"erklärte, daß, wenn de"
True_,Kafka,"sen hatte, seinem Herr"
True_,Kafka,", erzog er, in der Fur"
True_,Kafka,"nzeige, die sie, durch"
True_,Kafka," und Nicolo, seiner Ge"
True_,Kafka,"gt worden, in einem Wi"
True_,Kafka,"ne fremde, in das Land"
True_,Kafka," bestieg, mit einem Bl"
True_,Kafka," Tochter, die sie von "
True_,Kafka,"Tochter, die sie von d"
True_,Kafka,"e Klage, die er, im Na"
True_,Kafka,"ine Tür, die, an der h"
True_,Kafka,"ne Tür, die, an der hi"
True_,Kafka,"e Tür, die, an der hin"
True_,Kafka,"ause war, an Elvirens "
True_,Kafka,"ssen wollte, angeraten"
True_,Kafka," Pferde, mit einer sch"
True_,Kafka,"en. Hoango, dessen Kra"
True_,Kafka,"a der Graf, in einer g"
True_,Kafka,"illeneuve, ihres vorma"
True_,Kafka,"e letzte, die ihr bei "
True_,Kafka,"e gelobte, diesem, was"
True_,Kafka,"et hatte, ihre Schlafk"
True_,Kafka,"en verfiel, den Kohlha"
True_,Kafka,"ng gewiß, ohne bei ihr"
True_,Kafka,"ens; sie ließ, bei der"
True_,Kafka,"führte, hätte, unerhör"
True_,Kafka,"cheilte, rief, daß man"
True_,Kafka,"ntwortete, mit einem s"
True_,Kafka,"enblick, da sie, zu se"
True_,Kafka,"e junge Toni, die, weg"
True_,Kafka," uns das Tier, diesem "
True_,Kafka,"n an Paolo, ihren klei"
True_,Kafka,"ur, daß die, in den le"
True_,Kafka,"e Toni, die, wegen ihr"
True_,Kafka,"er dem Arm, so, daß es"
True_,Kafka,"! Sagte Toni, indem si"
True_,Kafka," dem Arm, so, daß es i"
True_,Kafka,"« Die Frau, indem sie "
True_,Kafka,"agte Toni, indem sie v"
True_,Kafka,"erwiderte, indem er mi"
True_,Kafka,"ie Tiere, die, auf wan"
True_,Kafka,"lbe, dem, bei seiner A"
True_,Kafka,"ttend, das, ernst und "
True_,Kafka,"prach er ihr, sobald e"
True_,Kafka," die Tat, die er began"
True_,Kafka,"ben, auf, ihnen nach d"
True_,Kafka,"den er ihm, in Bezug a"
True_,Kafka,"rr Strömli, dessen Wun"
True_,Kafka,"en warf, sagte, entsch"
True_,Kafka,"; und daß sie, aus Fam"
True_,Kafka,"auptmann, der, während"
True_,Kafka,"her sowohl, als auch d"
True_,Kafka,"ld legte, hinausreiche"
True_,Kafka,"lüpfen wollte, ein Tru"
True_,Kafka,"einbilde, er, der Kanz"
True_,Kafka,"aft hatte, einer Versa"
True_,Kafka,"r guten Elvire, welche"
True_,Kafka,"itet ist, der, könnt I"
True_,Kafka,"r setzte, mit einem et"
True_,Kafka,"derte Toni, indem sie "
True_,Kafka,"hn sogar, einige Jahre"
True_,Kafka,"eder erholte, vergesse"
True_,Kafka,"iel wieder, in Bezug a"
True_,Kafka,"leiner, alter, schneew"
True_,Kafka," von Tronka, als eine "
True_,Kafka,"m andern, als dem Kais"
True_,Kafka,"n Tronka, als eine fro"
True_,Kafka," sie Toni, die, dem Fr"
True_,Kafka,"nwohne, komme, warum s"
True_,Kafka,"e Toni, die, dem Fremd"
True_,Kafka,"nzuflößen, teils um da"
True_,Kafka,"en, fand, als er mit e"
True_,Kafka," Stunde, die er im Fle"
True_,Kafka,"ntwortete, mit einem v"
True_,Kafka," auf. Toni, sobald der"
True_,Kafka,"ieren war, in seinen A"
True_,Kafka,"gte die Alte, welche d"
True_,Kafka,"riefe, die er, um dem "
True_,Kafka,"dankenvoll, in Erwägun"
True_,Kafka,"rer Jugend, seine erst"
True_,Kafka,"er Größe, als der Euri"
True_,Kafka,"zen, der, bei ihrem An"
True_,Kafka,"ufloderte, einer der e"
True_,Kafka,"eigerufen, in dem Gema"
True_,Kafka,"ge kommt, ansetzen? – "
True_,Kafka,"adt aufhalte, seine Le"
True_,Kafka,"ut ansah, mit einigen "
True_,Kafka,"en schwoll, den Stall,"
True_,Kafka,"age darauf, diesen Vor"
True_,Kafka," melden, daß er, Kohlh"
True_,Kafka,"?« rief Toni, indem si"
True_,Kafka,"on Trota, sein Kämmere"
True_,Kafka,"ahren ließ, nieder, un"
True_,Kafka,"den ist, du, dessen gr"
True_,Kafka,"Freude, sagte, daß er "
True_,Kafka," als Nicolo, mit der M"
True_,Kafka,"uf Nicolo, der sie se"
True_,Kafka,"hreremal, ohne ihn zu "
True_,Kafka,"reremal, ohne ihn zu v"
True_,Kafka,"er Fremde, indem er, m"
True_,Kafka," Schwert, wisse, das d"
True_,Kafka,"n Wunde, die er, zu An"
True_,Kafka," von Tronka, in Verfol"
True_,Kafka,"ben. Ja, diese Teilnah"
True_,Kafka,"on Tronka, in Verfolg "
True_,Kafka,"remde leise, indem er "
True_,Kafka,", fragte sie, indem er"
True_,Kafka,"indem er, mit einem Sc"
True_,Kafka,"d hilflos, in der Mitt"
True_,Kafka,"und Nicolo, der Knabe,"
True_,Kafka," allem Volk, am Eingan"
True_,Kafka,"Roßhändler, dessen Per"
True_,Kafka,"pfahl, wo sie, den gan"
True_,Kafka,"Breysach, der, seit se"
True_,Kafka," erleide, verdient. De"
True_,Kafka,"em Wagen, der, nach Ar"
True_,Kafka,"aniederlag, in seinem "
True_,Kafka," Abend, sei sie, in di"
True_,Kafka,"ieser Zeit, Herse, dem"
True_,Kafka,"och da Elvire, starr v"
True_,Kafka," Töchter, die Erlaubni"
True_,Kafka,"gte die Alte, wo der F"
True_,Kafka,", und wie ihr, bei dem"
True_,Kafka,"ecker, der, einen Eime"
True_,Kafka,"obald Toni, die diesen"
True_,Kafka,"chelte, auf, sie zu be"
True_,Kafka,"er tretend, ein Mädche"
True_,Kafka,"Kohlhaas, mit Erlaubni"
True_,Kafka,"nden hatte, rief, inde"
True_,Kafka,"ipzig wollte, daß das "
True_,Kafka,"nd küßten ihn, und for"
True_,Kafka,"esden her, in seiner S"
True_,Kafka,"Jahre, war er, bei Gel"
True_,Kafka,"as, dem alten, die Wir"
True_,Kafka,"rklärte, daß, wenn der"
True_,Kafka," Der Feind, seinerseit"
True_,Kafka,"r Fremde, als er sich "
True_,Kafka,"lagt hätte, seine Seel"
True_,Kafka,"ierei, die, in Gebüsch"
True_,Kafka,"ern Ritter, in das Sch"
True_,Kafka," und Nicolo, seiner Ge"
True_,Kafka,"sprechen, an, stieg, a"
True_,Kafka,"echen, an, stieg, als "
True_,Kafka,"e Klage, die er, im Na"
True_,Kafka,"Klage, die er, im Name"
True_,Kafka,"m fand, das, geschürzt"
True_,Kafka,"eine Tür, die, an der "
True_,Kafka,"orfene, die, das Bewuß"
True_,Kafka,"und Gold, die sie uns "
True_,Kafka,"allen sollte, mit groß"
True_,Kafka,"ekümmerte, ein Spott d"
True_,Kafka,"en. Hoango, dessen Kra"
True_,Kafka,"a der Graf, in einer g"
True_,Kafka,"anzuhalten, sie, gegen"
True_,Kafka,"affen sollte, von mir "
True_,Kafka,"te verweilte, die Mutt"
True_,Kafka,"h länger, als eben nöt"
True_,Kafka,"te: Colino, genannt ha"
True_,Kafka,"Mühe hatte, seine Verl"
True_,Kafka," Antwort, die sie von "
True_,Kafka,"führte, hätte, unerhör"
True_,Kafka,"bt hatte, ihre Gemüter"
True_,Kafka,"te die Alte, indem sie"
True_,Kafka,"enblick, da sie, zu se"
True_,Kafka,"Fremde aß, in sein Ant"
True_,Kafka,"n an Paolo, ihren klei"
True_,Kafka,"nge Toni, die, wegen i"
True_,Kafka,"ge Toni, die, wegen ih"
True_,Kafka,"e Toni, die, wegen ihr"
True_,Kafka,"er dem Arm, so, daß es"
True_,Kafka,"! Sagte Toni, indem si"
True_,Kafka," dem Arm, so, daß es i"
True_,Kafka,"Sagte Toni, indem sie "
True_,Kafka,"em Arm, so, daß es ihn"
True_,Kafka," Rappen, die, wie er s"
True_,Kafka," Arm, so, daß es ihn b"
True_,Kafka,"ie Tiere, die, auf wan"
True_,Kafka,"nd Fremde, in der Gege"
True_,Kafka,"attend, das, ernst und"
True_,Kafka,"ire hinter ihm, mit Fl"
True_,Kafka,"tet waren, in seinen W"
True_,Kafka,"hn die Alte, indem sie"
True_,Kafka,"erden sollte, gegen ih"
True_,Kafka,"ederholte, und, auf sc"
True_,Kafka,"en Monden her, bekannt"
True_,Kafka,"t sowohl, als ihrer Kl"
True_,Kafka,"t bewohnte, einsam an "
True_,Kafka,"n warf, sagte, entschl"
True_,Kafka,"auptmann, der, während"
True_,Kafka,"te, gegen ihn, seines "
True_,Kafka,"haben wollte, und schi"
True_,Kafka,"or jagte, rief, um der"
True_,Kafka,"ise: Rosalie, ihre Kam"
True_,Kafka,"die weite, öde, entset"
True_,Kafka,"Sorgfalt, als er, bei "
True_,Kafka,"alt, daß ihn, bei Über"
True_,Kafka,"etzen wollte, nichts a"
True_,Kafka,"ihm sowohl, als an sei"
True_,Kafka,"eite, öde, entsetzlich"
True_,Kafka,"e Heloise, mit einem h"
True_,Kafka," alles Volk, über Bänk"
True_,Kafka,"gesagt, als, es täte i"
True_,Kafka,"f ihn ein, indessen Bl"
True_,Kafka,"tieg, die alte, von de"
True_,Kafka,"eg, die alte, von der "
True_,Kafka,"efahl Toni, die Fenste"
True_,Kafka,"iel wieder, in Bezug a"
True_,Kafka,"leiner, alter, schneew"
True_,Kafka," von Tronka, als eine "
True_,Kafka,"m andern, als dem Kais"
True_,Kafka,"röffnete, mit einem un"
True_,Kafka,"nwohne, komme, warum s"
True_,Kafka,"r Stunde, die er im Fl"
True_,Kafka,"r Mutter, die sie, wie"
True_,Kafka,"er meinte, in den Bart"
True_,Kafka,"spiegeln, daß, einer s"
True_,Kafka,"n Diener, der, mit zer"
True_,Kafka,"en war, wollte, vor Üb"
True_,Kafka,"Freiherr, der, über da"
True_,Kafka,"Roßhändler, dessen Wil"
True_,Kafka,"erettet, die, unter ei"
True_,Kafka,"dankenvoll, in Erwägun"
True_,Kafka,"und Nicolo, so hieß de"
True_,Kafka,"ührte sie, indem ihr d"
True_,Kafka," aufloderte, einer der"
True_,Kafka,"ehmen wollten, verblic"
True_,Kafka," Rührung, die sie nich"
True_,Kafka,"be. Die Alte, nach ein"
True_,Kafka," ersten, die sie veran"
True_,Kafka,"lenkette, die bekannte"
True_,Kafka,"lhaas, der, in eben di"
True_,Kafka,"Die Gräfin, die, mit T"
True_,Kafka," von Trota, sein Kämme"
True_,Kafka," rief Toni, indem sie "
True_,Kafka,"on Trota, sein Kämmere"
True_,Kafka,"d Leopold, seine beide"
True_,Kafka,"den ist, du, dessen gr"
True_,Kafka,"en ist, du, dessen gri"
True_,Kafka,"Verwalter, die, halb e"
True_,Kafka,"hältnisse, in dem Auge"
True_,Kafka," als Nicolo, mit der M"
True_,Kafka," geweckt, beide, obsch"
True_,Kafka,"ls Nicolo, mit der Müt"
True_,Kafka,"auswindend, rief er de"
True_,Kafka,"ragte Toni, indem sie "
True_,Kafka," worauf sie, indem sie"
True_,Kafka,"e, ja, daß er, bei der"
True_,Kafka,"en könne, mit einigen "
True_,Kafka,"erfolgte, hinweg! und "
True_,Kafka,"d führte ihn, über meh"
True_,Kafka,"ntwortete, mit einiger"
True_,Kafka,"twortete, mit einiger "
True_,Kafka,"er Toni, die, von manc"
True_,Kafka," scheine, sie ihm ausz"
True_,Kafka,"lt zwar, daß, wenn der"
True_,Kafka,"en Wunde, die er, zu A"
True_,Kafka,"en hatte, die Erklärun"
True_,Kafka," von Tronka, in Verfol"
True_,Kafka,"on Tronka, in Verfolg "
True_,Kafka,"lispel, das, wie es ih"
True_,Kafka,"remde leise, indem er "
True_,Kafka,"und hilflos, in der Mi"
True_,Kafka,"gen würde, indem er li"
True_,Kafka," Wagen, der, beim Anbr"
True_,Kafka,"und Nicolo, der Knabe,"
True_,Kafka,"erden sollte, rief jen"
True_,Kafka,"reysach, der, seit sei"
True_,Kafka,"ldsam, als er, über je"
True_,Kafka,"chtsherr, der, vor Koh"
True_,Kafka,"s am Abend, sei sie, i"
True_,Kafka,"aniederlag, in seinem "
True_,Kafka,"doch da Elvire, starr "
True_,Kafka,"bar dem Alten, der ihr"
True_,Kafka,"der Graf, der, durch d"
True_,Kafka,"mit Rosalien, ihrer Ka"
True_,Kafka,"nn würde, bis in sein "
True_,Kafka,"obald Toni, die diesen"
True_,Kafka,"zu helfen, in Ermangel"
True_,Kafka,"er tretend, ein Mädche"
True_,Kafka,"rtete sie, indem sie i"
True_,Kafka,"nden hatte, rief, inde"
True_,Kafka,"ipzig wollte, daß das "
True_,Kafka,"inquartierte, die Rapp"
True_,Kafka,"esden her, in seiner S"
True_,Kafka,"m der Graf, seinem Vor"
True_,Kafka,"ückte, daß, sobald der"
True_,Kafka,"as, dem alten, die Wir"
True_,Kafka,"rklärte, daß, wenn der"
True_,Kafka," Der Feind, seinerseit"
True_,Kafka," erzog er, in der Furc"
True_,Kafka,"f der Prior, indem er "
True_,Kafka," und Nicolo, seiner Ge"
True_,Kafka,"gt worden, in einem Wi"
True_,Kafka,"Hoango war, bei dem al"
True_,Kafka," Doch Toni, deren Brus"
True_,Kafka," Verfolger, die ein Op"
True_,Kafka,"r Pferde, die er bei s"
True_,Kafka,"rat, und ihn, in einer"
True_,Kafka,"Klage, die er, im Name"
True_,Kafka,"m fand, das, geschürzt"
True_,Kafka,"eine Tür, die, an der "
True_,Kafka,"orfene, die, das Bewuß"
True_,Kafka,"ne Tür, die, an der hi"
True_,Kafka,"e Tür, die, an der hin"
True_,Kafka,"eisen, der ihr, bei ih"
True_,Kafka,"allen sollte, mit groß"
True_,Kafka,"nker eben, mit einigen"
True_,Kafka,"en. Hoango, dessen Kra"
True_,Kafka,"anzuhalten, sie, gegen"
True_,Kafka," den Offizier, der sic"
True_,Kafka,"e gelobte, diesem, was"
True_,Kafka,"te: Colino, genannt ha"
True_,Kafka,"Mühe hatte, seine Verl"
True_,Kafka," Antwort, die sie von "
True_,Kafka,"ens; sie ließ, bei der"
True_,Kafka,"führte, hätte, unerhör"
True_,Kafka,"bt hatte, ihre Gemüter"
True_,Kafka,"ntwortete, mit einem s"
True_,Kafka," er forderte, in seine"
True_,Kafka,"ntwortete, mit einer f"
True_,Kafka,"r forderte, in seiner "
True_,Kafka,"Fremde aß, in sein Ant"
True_,Kafka,"age der Dame, wie er d"
True_,Kafka,"nge Toni, die, wegen i"
True_,Kafka,"ge Toni, die, wegen ih"
True_,Kafka,"e Toni, die, wegen ihr"
True_,Kafka," über rot, ihre Mutter"
True_,Kafka,"! Sagte Toni, indem si"
True_,Kafka," dem Arm, so, daß es i"
True_,Kafka,"Sagte Toni, indem sie "
True_,Kafka,"em Arm, so, daß es ihn"
True_,Kafka," Rappen, die, wie er s"
True_,Kafka,"rselbe, dem, bei seine"
True_,Kafka,"ie Tiere, die, auf wan"
True_,Kafka,"reten wollten, es erbl"
True_,Kafka,", fand, daß, obschon d"
True_,Kafka,"die Kinder, in einen W"
True_,Kafka,"tet waren, in seinen W"
True_,Kafka,"esetzt sei, ins Spiel "
True_,Kafka,", den er ihm, in Bezug"
True_,Kafka,"erden sollte, gegen ih"
True_,Kafka,"en hatte, in sein Zimm"
True_,Kafka,"en Monden her, bekannt"
True_,Kafka,"t bewohnte, einsam an "
True_,Kafka,"n warf, sagte, entschl"
True_,Kafka,"saß, und, um eines Sch"
True_,Kafka,"egt hatte, erstanden s"
True_,Kafka,"und ließ ihm, binnen z"
True_,Kafka," stand er, indem er al"
True_,Kafka,"or jagte, rief, um der"
True_,Kafka,"ise: Rosalie, ihre Kam"
True_,Kafka,"die weite, öde, entset"
True_,Kafka,"Sorgfalt, als er, bei "
True_,Kafka,"alt, daß ihn, bei Über"
True_,Kafka,"ten Note, als brandenb"
True_,Kafka,"uchen wollten, an eine"
True_,Kafka,"eite, öde, entsetzlich"
True_,Kafka,"e Heloise, mit einem h"
True_,Kafka," alles Volk, über Bänk"
True_,Kafka,"gesagt, als, es täte i"
True_,Kafka,"erte Toni, indem sie d"
True_,Kafka,"tieg, die alte, von de"
True_,Kafka,"loise saß, die, in Zei"
True_,Kafka,"ise saß, die, in Zeite"
True_,Kafka,"efahl Toni, die Fenste"
True_,Kafka,"gte den Alten, der dem"
True_,Kafka,"leiner, alter, schneew"
True_,Kafka," von Tronka, als eine "
True_,Kafka,"m andern, als dem Kais"
True_,Kafka,"röffnete, mit einem un"
True_,Kafka,"nwohne, komme, warum s"
True_,Kafka,"rstunden, ihre Staffel"
True_,Kafka,"nzuflößen, teils um da"
True_,Kafka,"reten wollte, sagte ih"
True_,Kafka,"r Mutter, die sie, wie"
True_,Kafka,"er meinte, in den Bart"
True_,Kafka,"spiegeln, daß, einer s"
True_,Kafka,"n Diener, der, mit zer"
True_,Kafka,"en war, wollte, vor Üb"
True_,Kafka,"Freiherr, der, über da"
True_,Kafka,"Roßhändler, dessen Wil"
True_,Kafka,"erettet, die, unter ei"
True_,Kafka,"dankenvoll, in Erwägun"
True_,Kafka," sein sollte, er mit s"
True_,Kafka,"ührte sie, indem ihr d"
True_,Kafka,"der Erde, als Elvire s"
True_,Kafka,"berkreise, in dem man "
True_,Kafka,"ßer etwa, daß er, auf "
True_,Kafka,"lenkette, die bekannte"
True_,Kafka,"ebt hatte, niederzukni"
True_,Kafka,"lhaas, der, in eben di"
True_,Kafka,"Die Gräfin, die, mit T"
True_,Kafka,"« sagte Toni, indem si"
True_,Kafka,"sagte Toni, indem sie "
True_,Kafka,"rer sowohl, als ihres "
True_,Kafka," von Trota, sein Kämme"
True_,Kafka," rief Toni, indem sie "
True_,Kafka,"bstrache, als er sich "
True_,Kafka,"ntfernt, diesem Antrag"
True_,Kafka,"ahren ließ, nieder, un"
True_,Kafka,"en werde, hingehalten "
True_,Kafka,"n; daß er, mit einem W"
True_,Kafka,"ten werde, ihm einen W"
True_,Kafka,"ngekommen war, seinen "
True_,Kafka,"hältnisse, in dem Auge"
True_,Kafka,"den würde, ja, daß er,"
True_,Kafka," geweckt, beide, obsch"
True_,Kafka,"dlungen, die sie von e"
True_,Kafka,"flichen Elvire, die we"
True_,Kafka," worauf sie, indem sie"
True_,Kafka,"en könne, mit einigen "
True_,Kafka,"chien, vor ihm, gleich"
True_,Kafka,"zutreten, sagte, schon"
True_,Kafka,"e, und er, indem er da"
True_,Kafka," erwarten ihn, falls e"
True_,Kafka,"t ward, rief, da seine"
True_,Kafka,"a sowohl, als seine Fr"
True_,Kafka," scheine, sie ihm ausz"
True_,Kafka,"en Wunde, die er, zu A"
True_,Kafka,"en hatte, die Erklärun"
True_,Kafka,"er Herr, diese Kapsel!"
True_,Kafka,"remde leise, indem er "
True_,Kafka,"und hilflos, in der Mi"
True_,Kafka,"gen würde, indem er li"
True_,Kafka," Wagen, der, beim Anbr"
True_,Kafka,"und Nicolo, der Knabe,"
True_,Kafka,"iderte, daß sie, in di"
True_,Kafka,"en trat er, in Begleit"
True_,Kafka,"n trat er, in Begleitu"
True_,Kafka,"erden sollte, rief jen"
True_,Kafka,"enster eilte, um sie z"
True_,Kafka,"dem Mittel, diese Sach"
True_,Kafka,"s am Abend, sei sie, i"
True_,Kafka,"aniederlag, in seinem "
True_,Kafka,"Kämmerer, der, vor Wut"
True_,Kafka,"assen wollte, da; bis "
True_,Kafka,"ieser Zeit, Herse, dem"
True_,Kafka,"doch da Elvire, starr "
True_,Kafka,"och da Elvire, starr v"
True_,Kafka,"er Sache, an, was dies"
True_,Kafka,"gte die Alte, wo der F"
True_,Kafka,"Herse, daß er, in eine"
True_,Kafka,"obald Toni, die diesen"
True_,Kafka,"er tretend, ein Mädche"
True_,Kafka,"rtete sie, indem sie i"
True_,Kafka," ersten, ihm, wie er v"
True_,Kafka,"g die wäre, einen Verh"
True_,Kafka,"ipzig wollte, daß das "
True_,Kafka,"esden her, in seiner S"
True_,Kafka,"sicherte, daß, wenn si"
True_,Kafka,"Jahre, war er, bei Gel"
True_,Kafka,"as, dem alten, die Wir"
True_,Kafka,"r Fremde, als er sich "
True_,Kafka," erzog er, in der Furc"
True_,Kafka,"ierei, die, in Gebüsch"
True_,Kafka," und Nicolo, seiner Ge"
True_,Kafka,"sprechen, an, stieg, a"
True_,Kafka,"loren, die er, in Gesc"
True_,Kafka,"r Pferde, die er bei s"
True_,Kafka,"e Klage, die er, im Na"
True_,Kafka,"rat, und ihn, in einer"
True_,Kafka,"Klage, die er, im Name"
True_,Kafka,"m fand, das, geschürzt"
True_,Kafka,"eine Tür, die, an der "
True_,Kafka,"n Stunde, mit einer kl"
True_,Kafka,"und Gold, die sie uns "
True_,Kafka,"e Tür, die, an der hin"
True_,Kafka,"ern würde, verstehen s"
True_,Kafka,"ause war, an Elvirens "
True_,Kafka,"fallen sollte, mit gro"
True_,Kafka,", als Toni, die Latern"
True_,Kafka,"en. Hoango, dessen Kra"
True_,Kafka,"te verweilte, die Mutt"
True_,Kafka," den Offizier, der sic"
True_,Kafka,"Leute so, die sie, in "
True_,Kafka,"te: Colino, genannt ha"
True_,Kafka,"ute so, die sie, in be"
True_,Kafka,"hrige Paolo, von demse"
True_,Kafka,"ng gewiß, ohne bei ihr"
True_,Kafka,"bt hatte, ihre Gemüter"
True_,Kafka," er forderte, in seine"
True_,Kafka,"e Pferde, die er in de"
True_,Kafka,"Fremde aß, in sein Ant"
True_,Kafka,"age der Dame, wie er d"
True_,Kafka,"nge Toni, die, wegen i"
True_,Kafka,"ge Toni, die, wegen ih"
True_,Kafka,", daß die, in den letz"
True_,Kafka,"loß von Elviren, ihm u"
True_,Kafka,"Sagte Toni, indem sie "
True_,Kafka,"agte Toni, indem sie v"
True_,Kafka," Rappen, die, wie er s"
True_,Kafka,"erwiderte, indem er mi"
True_,Kafka,"rbrachte, als, auf jäm"
True_,Kafka,"reten wollten, es erbl"
True_,Kafka,"ire hinter ihm, mit Fl"
True_,Kafka," wiederholte, und, auf"
True_,Kafka,", den er ihm, in Bezug"
True_,Kafka,"ten hatte, in sein Zim"
True_,Kafka,"ederholte, und, auf sc"
True_,Kafka,"t bewohnte, einsam an "
True_,Kafka,"; und daß sie, aus Fam"
True_,Kafka," und daß sie, aus Fami"
True_,Kafka,"saß, und, um eines Sch"
True_,Kafka,"egt hatte, erstanden s"
True_,Kafka,"rzimmer, wo er, mit kl"
True_,Kafka,"zimmer, wo er, mit klo"
True_,Kafka,"haben wollte, und schi"
True_,Kafka,"lüpfen wollte, ein Tru"
True_,Kafka,"or jagte, rief, um der"
True_,Kafka,"r jagte, rief, um der "
True_,Kafka,"ise: Rosalie, ihre Kam"
True_,Kafka,"Sorgfalt, als er, bei "
True_,Kafka,"alt, daß ihn, bei Über"
True_,Kafka,"etzen wollte, nichts a"
True_,Kafka,"uchen wollten, an eine"
True_,Kafka,"eite, öde, entsetzlich"
True_,Kafka,"agte ihn, ob er, nachd"
True_,Kafka," alles Volk, über Bänk"
True_,Kafka,"gesagt, als, es täte i"
True_,Kafka,"tieg, die alte, von de"
True_,Kafka,"resden, wo er, in eine"
True_,Kafka,"ise saß, die, in Zeite"
True_,Kafka,"iel wieder, in Bezug a"
True_,Kafka,"leiner, alter, schneew"
True_,Kafka," von Tronka, als eine "
True_,Kafka,"m andern, als dem Kais"
True_,Kafka,"n Tronka, als eine fro"
True_,Kafka," sie Toni, die, dem Fr"
True_,Kafka,"e Toni, die, dem Fremd"
True_,Kafka,"nzuflößen, teils um da"
True_,Kafka,"er bat er, in einer ku"
True_,Kafka,"er meinte, in den Bart"
True_,Kafka,"s führten, mit einem F"
True_,Kafka,"n Diener, der, mit zer"
True_,Kafka,"ht hatte, an seinem Be"
True_,Kafka,"Freiherr, der, über da"
True_,Kafka,"Roßhändler, dessen Wil"
True_,Kafka,"erettet, die, unter ei"
True_,Kafka,"dankenvoll, in Erwägun"
True_,Kafka," sein sollte, er mit s"
True_,Kafka,"ührte sie, indem ihr d"
True_,Kafka,"der Erde, als Elvire s"
True_,Kafka," Rührung, die sie nich"
True_,Kafka,"ßer etwa, daß er, auf "
True_,Kafka,"teste war, indem sie d"
True_,Kafka,"lenkette, die bekannte"
True_,Kafka,"lhaas, der, in eben di"
True_,Kafka,"ut ansah, mit einigen "
True_,Kafka,"sagte Toni, indem sie "
True_,Kafka,"agte Toni, indem sie d"
True_,Kafka,"und rief ihn, seinen s"
True_,Kafka,"rer sowohl, als ihres "
True_,Kafka," von Trota, sein Kämme"
True_,Kafka," rief Toni, indem sie "
True_,Kafka,"on Trota, sein Kämmere"
True_,Kafka,"ntfernt, diesem Antrag"
True_,Kafka,"innen wollte, bis wir,"
True_,Kafka,"d glänzend, ins Auslan"
True_,Kafka,"en ist, du, dessen gri"
True_,Kafka,"ten werde, ihm einen W"
True_,Kafka,"en werde, ihm einen Wa"
True_,Kafka,"folgt, wollte, daß Pia"
True_,Kafka,"den würde, ja, daß er,"
True_,Kafka," geweckt, beide, obsch"
True_,Kafka,"ls Nicolo, mit der Müt"
True_,Kafka,"lt, den Brief, den sie"
True_,Kafka,"flichen Elvire, die we"
True_,Kafka," worauf sie, indem sie"
True_,Kafka,"e, ja, daß er, bei der"
True_,Kafka,"en könne, mit einigen "
True_,Kafka,"chien, vor ihm, gleich"
True_,Kafka,"ntwortete, mit einiger"
True_,Kafka,"twortete, mit einiger "
True_,Kafka,"er Toni, die, von manc"
True_,Kafka,"a sowohl, als seine Fr"
True_,Kafka," scheine, sie ihm ausz"
True_,Kafka,"bedurfte, als Einsicht"
True_,Kafka,"machen sollte, ein Zei"
True_,Kafka,"lt zwar, daß, wenn der"
True_,Kafka,"en Wunde, die er, zu A"
True_,Kafka,"en hatte, die Erklärun"
True_,Kafka," von Tronka, in Verfol"
True_,Kafka,"remde leise, indem er "
True_,Kafka,"und hilflos, in der Mi"
True_,Kafka,"ie Kette, die ihm vom "
True_,Kafka," Wagen, der, beim Anbr"
True_,Kafka,"und Nicolo, der Knabe,"
True_,Kafka," allem Volk, am Eingan"
True_,Kafka,"n trat er, in Begleitu"
True_,Kafka,"erden sollte, rief jen"
True_,Kafka,"macht, der, in so kurz"
True_,Kafka,"enster eilte, um sie z"
True_,Kafka,"Fremde ja, ihres Wisse"
True_,Kafka,"s am Abend, sei sie, i"
True_,Kafka,"twortete, mit einer Re"
True_,Kafka,"doch da Elvire, starr "
True_,Kafka,"bar dem Alten, der ihr"
True_,Kafka,"er Sache, an, was dies"
True_,Kafka,"ecker, der, einen Eime"
True_,Kafka,"obald Toni, die diesen"
True_,Kafka,"n Herolds, beide, von "
True_,Kafka,"Kohlhaas, mit Erlaubni"
True_,Kafka,"ne Tochter, eine Mesti"
True_,Kafka,"g die wäre, einen Verh"
True_,Kafka,"ipzig wollte, daß das "
True_,Kafka,"esden her, in seiner S"
True_,Kafka,"sicherte, daß, wenn si"
True_,Kafka,"icherte, daß, wenn sie"
True_,Kafka,"as, dem alten, die Wir"
True_,Kafka,"nvermutet, in eben die"
True_,Kafka," Gebärden, mit sich fo"
True_,Kafka,"r Fremde, als er sich "
True_,Kafka," erzog er, in der Furc"
True_,Kafka,"f der Prior, indem er "
True_,Kafka,"fzuge, der ihm, seit s"
True_,Kafka," Doch Toni, deren Brus"
True_,Kafka,"lt hatte, als den Vate"
True_,Kafka,"r Pferde, die er bei s"
True_,Kafka,"rat, und ihn, in einer"
True_,Kafka,"Klage, die er, im Name"
True_,Kafka,"m fand, das, geschürzt"
True_,Kafka,"eine Tür, die, an der "
True_,Kafka,"n Stunde, mit einer kl"
True_,Kafka,"und Gold, die sie uns "
True_,Kafka,"m Ritter, mit einem fu"
True_,Kafka,"fallen sollte, mit gro"
True_,Kafka,"h irgend, rief sie, mi"
True_,Kafka,"er fragte, indem er ih"
True_,Kafka,"nker eben, mit einigen"
True_,Kafka,"anzuhalten, sie, gegen"
True_,Kafka,"affen sollte, von mir "
True_,Kafka," Tronka, dieser Kämmer"
True_,Kafka,"h länger, als eben nöt"
True_,Kafka,"Leute so, die sie, in "
True_,Kafka,"te: Colino, genannt ha"
True_,Kafka,"hrige Paolo, von demse"
True_,Kafka," Antwort, die sie von "
True_,Kafka,"bt hatte, ihre Gemüter"
True_,Kafka,"higen wolle, mit ferne"
True_,Kafka,"er Fremde aß, in sein "
True_,Kafka,"e Pferde, die er in de"
True_,Kafka,"Fremde aß, in sein Ant"
True_,Kafka,"age der Dame, wie er d"
True_,Kafka,"nge Toni, die, wegen i"
True_,Kafka,"ge Toni, die, wegen ih"
True_,Kafka," über rot, ihre Mutter"
True_,Kafka,"loß von Elviren, ihm u"
True_,Kafka,"zu wenden, indem, wenn"
True_,Kafka,"nähren sollte, sind di"
True_,Kafka," Rappen, die, wie er s"
True_,Kafka,"rselbe, dem, bei seine"
True_,Kafka,"rbrachte, als, auf jäm"
True_,Kafka,"reten wollten, es erbl"
True_,Kafka,"n Tronka, als dem allg"
True_,Kafka,"die Kinder, in einen W"
True_,Kafka,"sinuation, bei dem Dre"
True_,Kafka," wiederholte, und, auf"
True_,Kafka,", den er ihm, in Bezug"
True_,Kafka,"ten hatte, in sein Zim"
True_,Kafka,"ederholte, und, auf sc"
True_,Kafka,"t bewohnte, einsam an "
True_,Kafka,"n warf, sagte, entschl"
True_,Kafka," und daß sie, aus Fami"
True_,Kafka,"da dieser, in eben die"
True_,Kafka,"saß, und, um eines Sch"
